"id","tag","tag 2","tag 3","tag 4","point","date","txt","txt 2","txt 3","txt_inner"
"고양이강아지","","","","","5점만점에 5점","2025.01.09","지성에 좋아요","진정에 좋아요","자극없이 순해요","이거 효과 없다는 사람도 있던데 전 정말 효과 봤어서 사춘기 조카한테도 사주고, 저도 잘 사용하고 있어요. 연말 연초 피곤해서 트러블이 잦고, 아이들도 갑자기 올라오는 뾰루지에도 발라줬어요. 금방 없어질 때도 있지만 심하면 한 번에 들어가지는 않고, 여러 번 발라주면 흉터 없이 가라앉아요. 암튼 얼굴 뾰루지에 잘 들고 회복 속도도 빨라요. 땡땡한 여드름, 코에 엄청 아픈 뾰루지까지 발라주면 어쩔 땐 염증 없이도 가라앉더라고요. 연고를 발랐다는 생각이 들어서인지 손도 확실이 덜 타서 그런 거 같아요. 지금 사용하는 게 얼마 남지 않아 쟁여템했어요."
"이광수","","","","","5점만점에 5점","2025.01.08","지성에 좋아요","진정에 좋아요","자극없이 순해요","유튜버가 사용하는 거 보고 구매할까 말까 했어요.사람마다 효과가 달라서 고민했는데하루 써보고는 잘 모르겠지만 연고형식으로 그 부분만 발라도 되는 거라 좋아요! 근데 가격에 비해 용량은 적어서 아쉬워요..부드럽게 발려서 좋긴해요! 제가 턱쪽에 진짜 한 1-2주 무슨 혹 난 거 처럼 트러블이 났는데.. 짜고해도 안에 계속 차있서 했거든요.. 지금은 진정이 많이 된 상태이긴하지만 어제 그부분이랑 볼 쪽 뾰루지? 난 곳에 바르고 잤는데 괜찮은 것 같긴해요! 일단 꾸준히 써보고 다시 말할게요!"
"치키차카초초","복합성","웜톤","모공","민감성","5점만점에 5점","2025.01.03","복합성에 좋아요","진정에 좋아요","자극없이 순해요","여기저기 여드름이 많이 나는데 사용하려고 구매했습니다반투명한 하얀 크림 제형이에요이름처럼 일랑일랑 향이 나는데 크게 거슬릴 정도는 아니고 은은해서 괜찮았습니다일랑일랑 향과 연고 향이 살짝 섞인 듯해요 저는 괜춘~입구가 뾰족해서 바르고 싶은 부위에 소량씩 바르기 용이합니다촉촉 쫀쫀 하니 마무리 돼서 사용하기에 만족스러워요여드름 짠 다음에 사용하면 효과가 꽤 있어요!!!!!"
"꼼꼬민","민감성","여름쿨톤","민감성","블랙헤드","5점만점에 5점","2024.12.31","복합성에 좋아요","진정에 좋아요","보통이에요","보통 뽀류지나 트러블 나면 에크논 발라주고 짠 후 패치 붙이고 다음날부터는 마데카솔 발라주는데 친구가 이거 엄청 잘 ㅅ쓴다길래 사 봄마데카솔고ㅏ 비슷한 역할을 한다고 보는데,, 이런 연고에도 알러지가 있을 수 있으니 주의해야함..그리고 음.. 엄청난 효과는 모르겠음.. 아마 마데카솔 살 거 같네요^^"
"쥬쥬j","복합성","웜톤","모공","미백","5점만점에 5점","2024.12.29","복합성에 좋아요","진정에 좋아요","자극없이 순해요","수분크림처럼 부드럽게 잘 발리는 제형이에요트러블 올라오려고 할때, 올라왔을때와 터졌을때 발라주고 있어요 피부 뒤집어질때 필수템이라 이제 없으면 불안하더라구요 다만 여러통 써봤지만 여드름 흉터에는 효과 못 봤어요저는 기초케어 후 특수부위만 사용해주거나 넓게 도포할때는 크림 대신 사용해주고 있어요!"
"달까지반나절","","","","","5점만점에 5점","2024.12.15","복합성에 좋아요","진정에 좋아요","자극없이 순해요","여드름, 뽀루지 상처에 좋다고 해서 구입했어요.턱에 상처로 부어서 발랐는데.. 진정이 되는것 같아요. 향도 은은한것이 마음의 진장까지 되는듯해요.피부가 예민해서 날선듯한.. 그런 상태인데..바르고 하룻밤 자고 나니. 정돈이 된것 같아요.피부 진정에 좋은것 같아요"
"부리부리짱","트러블성","봄웜톤","모공","민감성","5점만점에 5점","2024.12.15","건성에 좋아요","진정에 좋아요","자극없이 순해요","여드름에 효과 좋은 연고라고 해서 사봤어요. 제가 툭하면 여드름이 나다 보니 이런 연고가 필요한데 진정에 도움이 되는 것 같아 한번 구매해 봤습니다. 아직 큰 효과는 잘 모르겠지만 뭔가 다음 날 진정이 된 것 같아 꾸준히 써볼려고요. 약간 보습감이 좀 느껴지는 연고 입니다"
"코코천사","복합성","겨울쿨톤","각질","다크서클","5점만점에 5점","2024.12.15","복합성에 좋아요","진정에 좋아요","자극없이 순해요","피부과 처방전 없이 사용할 것에 대비해 미리 나구매했어요. 특히 요즘 나이가 들면서 여드름이 나거나 상처가 난 후 착색이 되면 금방 재생이 안 되더라구요. 그럴 때 사용하기 딱 좋은 연고인것 같아요. 또 가장 맘에 드는 건 빠르게 흡수 되고 끈적임이 없어서 좋아요."
"차가운걸좋아해","건성","겨울쿨톤","민감성","아토피","5점만점에 5점","2024.12.15","건성에 좋아요","진정에 좋아요","자극없이 순해요","그냥 화장품이 아닌 의약외품!그래서 상처, 피부궤양의 보조적 부분 치료가 가능하고,센텔라아시아티카 정량추출물 1% 함유한 끈적임 없는 연고토출구 사이즈가 좁아서 적정량 바르기 좋고일랑일랑 향이라는데 크게 느껴지는 편은 아님요즘 빨갛게 신경쓰이는 부분이 있어서 스킨케어 마지막 단계에 톡톡 올려주면 진정에 도움됨"
"멩롱낭","중성","미백","잡티","","5점만점에 5점","2024.12.15","복합성에 좋아요","진정에 좋아요","자극없이 순해요","스팟템으로 유명한 낫츠 ! 항생제는 없고 센텔라정량추출물이 들어 있어서 트러블 올라온 곳에 데일리로 발라주기 좋아요 ☺️센텔라정량추출물 사용한 스팟템 중에서 역시 낫츠가 사용감이 제일 좋은 거 같아요 너무 끈적거리지 않아서 펴바르는데 써도 되고 연고처럼 스팟에만 찍어줘도 돼요 :)"
"쥑쥑쥑","복합성","각질","모공","","5점만점에 5점","2024.12.15","복합성에 좋아요","진정에 좋아요","자극없이 순해요","🙌진정부터 흔적 케어까지🙌✅️ 제형하얀색 젤크림같은 제형입니다! 스팟 제품으로 사용하기 좋아요✅️ 진정여드름 압출 후 연고 바르고, 니들패치 붙여주면 금방 진정됩니다!✅️ 흔적 케어사실 여드름 흉터는 쉽게 없어지지 않는데, 연고 같이 써주면 확실히 안쓰는 것보다 빠르게 흉터가 옅어지는 것 같아요!"
"온찡","복합성","여름쿨톤","모공","잡티","5점만점에 5점","2024.12.15","복합성에 좋아요","진정에 좋아요","자극없이 순해요","여드름 연고 다써서 알아보다가 낫츠 제품 유명하길래 구입했어요보통 연고들은 너무 기름져서 오히려 주변에 트러블 유발하는 경우도 있었는데 산뜻한 수딩크림 제형이라 좋네요짜고나서 바르면 진정에 도움을 주는 느낌이고여드름이 아니더라도 자극받은 피부에 바르면 진정효과가 좋아요은은한 일랑일랑 향이 나는데 정말 은은해서인지하고 맡아야 느껴지는 정도예요!✨제 리뷰가 도움이 되셨다면 ""도움이 돼요""를 눌러주세요✨↓↓↓"
"야호얍","건성","웜톤","민감성","","5점만점에 5점","2024.12.15","복합성에 좋아요","진정에 좋아요","자극없이 순해요","요즘 이상하게 손에 상처가 많이 생겨서 꾸준히 바르면 흉터에 좀 도움이 될까 싶어 바르고 있어요. 일단 꾸덕꾸덕한 타입이 아니라 연고 특유의 답답함이 적어서 좋았어요. 토출구가 좁아 소량씩 양 조절하기도 편했습니다. 병풀 정량 추출물이라는데 그만큼 효과도 좋았으면 좋겠네요. 잘 사용하겠습니다."
"라밍","복합성","여름쿨톤","블랙헤드","잡티","5점만점에 5점","2024.12.15","복합성에 좋아요","진정에 좋아요","자극없이 순해요","구매한 연고를 사용해봤어요.여드름이나 상처 부위에 바르는 제품이라고 해서 손등의 작은 상처와 얼굴에 염증 난 곳 모두 사용해봤어요.연고 제형은 부드럽고 발림성이 좋아서 소량만으로도 잘 펴 발렸고, 연고 치고는 끈적임이 적고 빠르게 흡수되는 듯 해요. 손등의 상처는 며칠 꾸준히 바르니 덧나지 않은 듯 하고, 얼굴의 염증 부위도 성나지 않고 진정되면서 점차 가라앉는 것 같아요. 향은 없어요. 며칠 더 꾸준히 써보려해요"
"공돌군","약건성","봄웜톤","모공","주름","5점만점에 5점","2024.12.15","복합성에 좋아요","진정에 좋아요","자극없이 순해요","낫츠 연고 좋다좋다 소문만 듣다고 올영 세일기간에 드디어 구매해보게 되었네요@ 제형- 진짜 연고 제형입니다- 완전 꾸덕한 반투명 유백색 제형이에요@ 향- 일랑일랑이라고 해서 일랑일랑 꽃향기를 기대했는데 향은 거의 무향에 가까울 정도로 안나는 편이에요@ 사용감- 처음에는 용량이 굉장히 적구나 해서 놀랐습니다 - 그래도 입구가 적은 제품이라서 스팟 연고로 쓰기 좋았어요- 마데카솔 연고보다도 더 꾸덕한 제형이라서 두툼하게 올려서 스팟 연고로 쓰기 좋았습니다- 진정 효과는 아직은 잘 모르겠는데 열심히 쓰고 한달 후기도 남겨볼게요"
"카로카로카로","지성","웜톤","민감성","잡티","5점만점에 5점","2024.12.14","복합성에 좋아요","진정에 좋아요","자극없이 순해요","이거 한 유튜버분이 자주 애용하시는걸 봐서 궁금했던 제품인데할인하길래 아묻따 질렀어요평소에도 이런 스팟제품 같은 연고?를 좀 애용하는 편인데,이거 의약외품인데도 생각보다 제품력이 좋은 것 같아요.아무래도 스팟제품이라 용량이 많지는 않아서진짜 필요한 부분에만 조금씩 짜내서 롤링하는 식으로 사용하고 있는데,나이트케어로 한번 사용하고 나면 진정이 잘 되는 느낌이 확 듭니다.저 민감한 지성피부인데 이 제품 쓰면서 트러블나거나 안맞는다는 느낌 받은적 1도없구요향도 은은하게 꽃향 나는 것 같아서 진짜 연고들 특유의 냄새 없어 좋았어요.제형감 자체는 진짜 피부과 연고처럼 무거운 편에 속하는데발림성 자체는 끈적임도 덜하고 생각보다는 스무스하게 발려서 사용감이 나쁘거나 하진 않더라구요.가격대도 제가 생각한 딱 그정도인 것 같아서 저는 만족스럽게 사용중이네요."
"고양이강아지","","","","","5점만점에 5점","2024.12.09","지성에 좋아요","진정에 좋아요","자극없이 순해요","트러블 잘 나는 지성피부라 어렸을 때 지독하게도 여드름과 전쟁을 치뤘는데, 어른 되면 안 생긴다더니 아직도 한 번씩 아픈 화농성으로 뾰루지가 나요. 어렸을 땐 무조건 짜고 손 먼저 갖다 댔는데 요즘은 참 좋은 제품들이 많이 나오네요. 뾰루지 나는 부분에 요거 발라주면 붉은 염증도 빠르게 가라앉고, 압출하고 나서 진정용으로 바르면 흔적도 잘 남지 않아서 좋아요. 여드름 나기 시작하는 조카한테도 선물해 주고, 얼굴에 하나씩 뾰루지가 나는 아이한테도 바로 이거 바르라고 합니다. 유분이 없는 건 아니라서 저녁 케어용으로 사용하는 게 저로서는 더 좋았어요. 화장 전에 사용하니까 유분이 생겨서 지속력이 떨어지더라고요. 한 번에 많은 양을 사용하기보다는 얇게 바르고 시간 지나 덧바르고 하는 게 효과가 더 좋은 것 같아요. 사용 기한 27년 4월까지로 넉넉하고, 보습용으로 사용하기보단 연고로 사용하다 보니 용량은 15g으로 작지만 오래 사용할 수 있어요. 더 좋은 제품 찾기 전까진 재구매 할 것 같아요."
"또사야지","복합성","쿨톤","다크서클","블랙헤드","5점만점에 5점","2024.12.09","복합성에 좋아요","진정에 좋아요","자극없이 순해요","상처받은피부를 대비하기위해 미리구매한 상처연고제예요~ 센텔라아시아티카 성분으로 빠른흡수력과 치료에 도움을 받을수있다고해서 구매했어요! 은은한 향과 끈적이지않는 사용감이 연고같지않지만 효과가 너무좋아 상처난곳에 유용히 잘사용하려구요:)"
"뮤진26","민감성","가을웜톤","각질","모공","5점만점에 5점","2024.12.05","복합성에 좋아요","진정에 좋아요","자극없이 순해요","고민고민하다 드디어 구매해본 일랑일랑 워낙 고민부위가 많아서 일단 다 발라봄 발임성은 좋지만 위애 화장을 하는 건 어려울듯 ㅠ 나이트 스킨케어 루틴에만 추가하기로 함 꾸준히 써봐야 알겠지만 우선 향도 없고 토출구도 뾰족해서 맘에듬효과봤으면 ㅠ"
"라잇","","","","","5점만점에 5점","2024.12.05","복합성에 좋아요","진정에 좋아요","자극없이 순해요","아랑님 유튜브 보고 효과 좋은 것 같아서 구매해봤어요ㅎㅎ 여드름 나고 나면 흔적들이 남아서 스트레스였는데, 낫츠 꾸준히 바르니까 흔적이 점점 옅어지는 것 같아서 만족해요!! 처음엔 15g이라 좀 적지 않나 싶었는데, 받아서 써보니까 여드름용 연고같더라구요ㅎㅎ 연고라 생각하면 적은 양은 아닌 것 같아요!여드름 난 후에 케어에도 좋고, 여드름 날 것 같은 부위에 미리 발라줘도 여드름이 들어가는 것 같아서 여기저기 잘 쓰고 있어용~!"
"치키차카초초","복합성","웜톤","모공","민감성","5점만점에 5점","2024.12.04","복합성에 좋아요","진정에 좋아요","자극없이 순해요","여기저기 여드름이 많이 나는데 사용하려고 구매했습니다반투명한 하얀 크림 제형이에요이름처럼 일랑일랑 향이 나는데 크게 거슬릴 정도는 아니고 은은해서 괜찮았습니다일랑일랑 향과 연고 향이 살짝 섞인 듯해요 저는 괜춘~입구가 뾰족해서 바르고 싶은 부위에 소량씩 바르기 용이합니다촉촉 쫀쫀 하니 마무리 돼서 사용하기에 만족스러워요꾸준히 사용해 보고 한 달 후기로 돌아올게요☺️"
"유낄낄","건성","가을웜톤","다크서클","민감성","5점만점에 5점","2024.12.04","건성에 좋아요","보습에 좋아요","보통이에요","낫츠 센텔라스카 연고, 요즘 흉터 관리하려고 잘 바르고 있어요. 끈적임 없이 산뜻하게 발려서 바른 후에도 부담이 없고, 흡수도 빨라서 간편하게 사용할 수 있어요. 민감한 피부에도 순하게 사용할 수 있는 성분이라 안심하고 매일 쓰고 있어요. 깔끔한 튜브 타입이라 위생적으로 쓸 수 있고 휴대하기도 좋아서 편리해요. 흉터 부위에 꾸준히 바르기 딱 좋은 제품이에요!"
"미니무스","건성","가을웜톤","미백","잡티","5점만점에 4점","2024.12.03","건성에 좋아요","진정에 좋아요","자극없이 순해요","일반 상처에 발라보았습니다.물론 상처 직후는 아니구요. 어느정도 아물어서 딱지가 떨어진 다음 혹시 흉터를 조금이라도 줄일 수 있을까 싶어 발라보았습니다.휴대가 편한 크기여서 가지고 다니면서 수시로 발라주었구요. 거스러미 때문에 상처 난 손끝에도 발라보았습니다.일단 자극은 없었구요. 3일정도 사용해보니 상처 주변 피부가 일어나서 거슬리거나 하는게 확실히 줄어드네요.(두번째사진 1회 바름, 3번째 사진 3일차)"
"빵먹고싶은사람","민감성","웜톤","모공","블랙헤드","5점만점에 5점","2024.12.02","복합성에 좋아요","진정에 좋아요","자극없이 순해요","잊을만 하면 리뷰 쓸 날짜가 돌아오는 미스터리 연고 ..꾸준한 재구매란 이런것일까요 ? 🩹📍흉터 옅어지는 데에 좋다고 해서 꾸준히 썼지만 솔직히 이게 피부 자체의 회복력인지 연고의 효능인지 모르겠어서 지난번에 다 쓰고나서는 재구매를 안했었거든요근데 얼마전에 제가 나비존 부분을 긁다가 여러군데에 피부가 까지면서 따가운 흉터가 생겼었는데 ㅠ ㅠ 아무것도 안바르고 버티다가 도저히 안되겠어서 속는셈치고 다시 샀단말이죠그리고 .. 며칠동안 지지부진하던 상처들이 이거 바르자마자 이틀만에 흉이 거의 사라졌어요 이렇게 흔적이 빨리 사라지는 걸 처음 봤음 그때 깨달았죠 이 연고 돈값을 하긴 하는구나 💸📍솔직히 말해서 오래된 흉터에는 큰 효과가 없는 것 같고 생긴지 얼마 안 된 흉터에는 효과가 있어요 !!상처가 나면 따가우니까 보통 트러블 패치같은걸 붙이잖아요 그거 한 이틀 붙여서 어느정도 수습한 다음부터 이거 꾸준히 발라주면 안 발랐을때보다 흔적이 옅어지는 속도가 빨라요 📍발림성은 그냥 가벼운 연고? 진득함은 없어요약간 기름진것같기도 해요 그래서 저는 저녁에만 바릅니다+ 기름진 느낌때문에 혹시 트러블을 유발할까 걱정되기도했지만 사용해보니 딱히 그런 건 없는 것 같아요!!💥총평 : 효과 없는 줄 알았는데 효과가 있었던 연고 ㅎ저는 허구한 날 트러블을 손으로 건드려서 피부가 점박이가 되기땜에 이 제품과 계속 함께할거같네요 ^^.."
"스초생","복합성","웜톤","미백","주름","5점만점에 5점","2024.12.02","복합성에 좋아요","진정에 좋아요","보통이에요","믿고쓰는 아랑픽... 트러블 연고를 이번 년도에 몇개를 사봤는지.모르겠어요... 낫츠 연고 궁금했는데 드디어 써봅니다 생각보다 띡하지않고 흡수가 잘돼서 좋았어요 ㅎㅎ 용량이 작다고 느낄수도 있지만 농축된거라 그만큼 진정 효과가 뛰어난거같아서 꾸준히 쓸거같아요 ㅎㅎ"
"그르르르응","복합성","웜톤","모공","미백","5점만점에 5점","2024.12.02","지성에 좋아요","진정에 좋아요","자극없이 순해요","낫츠 연고는 진짜 많이 들어봤는데 기존에 쓰던 연고가 다 떨어져서 낫츠껄로 사봤어요유튜버분이 엄청 좋다고하셔서 어떨까했는데 일단 연고라고 되어있지만 막 흔한연고같이 흡수가 안된다거나 무겁지않아서 사용하기좋았고 특히 센텔라정량추출물을 사용했기때문인지 은근하게 진정에좋았어요"
"필리뽀","복합성","웜톤","다크서클","모공","5점만점에 5점","2024.12.01","복합성에 좋아요","보습에 좋아요","자극없이 순해요","낫츠 센텔라스카 연고는 피부 진정 효과가 정말 탁월해요. 자극받은 부위에 발랐더니 빠르게 진정되고 붉은 기운도 많이 가라앉았어요. 끈적임 없이 산뜻하게 흡수돼서 사용감도 좋고, 민감한 피부에도 잘 맞아 만족스럽습니다. 피부 고민이 있을 때 믿고 쓸 수 있는 연고예요!"
"드뮤어","복합성","웜톤","각질","다크서클","5점만점에 5점","2024.11.30","복합성에 좋아요","진정에 좋아요","자극없이 순해요","여드름이나 상처 흔적 케어에 좋다고해서 구매했어요제형은 수분크림처럼 부드럽게 잘 흡수되는 제형이에요발림성이 가볍고 산뜻해서 괜찮아요 여드름 흔적 부분에 꾸준히 발라보고 한달후기에 다시 후기 남길게요 흔적이 옅어지길 바래봅니다"
"삐빠뽀뿌","민감성","봄웜톤","트러블","","5점만점에 5점","2024.11.30","복합성에 좋아요","주름/미백에 좋아요","자극없이 순해요","흔적 케어를 위해서 꾸준히 재구매하면서 사용하고 있는 제품이에요. 원래 마켓으로 구매했는데 올영 입점해서 올영으로 구매해봤어요. 처음에 반신반의하면서 사용했는데, 사용하면서 옅어지는 느낌이 들어서 계속 재구매 중입니다. 기름진 제형이 아니어서 좋아욤"
"쥬쥬j","복합성","웜톤","모공","미백","5점만점에 5점","2024.11.29","복합성에 좋아요","진정에 좋아요","자극없이 순해요","수분크림처럼 부드럽게 잘 발리는 제형이에요트러블 올라오려고 할때, 올라왔을때와 터졌을때 발라주고 있어요 피부 뒤집어질때 필수템이라 이제 없으면 불안하더라구요 다만 여러통 써봤지만 여드름 흉터에는 효과 못 봤어요저는 기초케어 후 특수부위만 사용해주거나 넓게 도포할때는 크림 대신 사용해주고 있어요!"
"피부야제발","복합성","웜톤","각질","다크서클","5점만점에 5점","2024.11.27","복합성에 좋아요","진정에 좋아요","자극없이 순해요","첫번째 사진 11월 24일두번째 사진 11월 27일이 연고만 사용한건 아니라서 단순히 낫츠 연고의 효과다!!라고 말은 못하지만 분명 도움은 줬겠죠? 전 너무너무 잘 맞아서 압출 후에는 꼭꼭 사용하고 흔적 남아있는 것에도 꾸준히 사용해요.주1회마다 압출을 하고 있어서 이 연고 없으면 안됨...나랑 평생 가자고...."
"황금손","민감성","쿨톤","","","5점만점에 5점","2024.11.08","건성에 좋아요","진정에 좋아요","자극없이 순해요","의약외품이라 안심하고 사용할 수 있어 좋았어요얼굴에 트러블이 자주 생겨서 그때마다 조금씩 발라줬는데금방 사그러디는거 같아 좋았어요바르면서도 유명한걸 막 체감했어요ㅎㅎ연고처럼 막 찐득한 느낌이 없어 발림성도 좋았어요얼굴뿐만 아니라 다른곳도 좀 심하게 뭐 생기면 발라주고 있어요은근 양도 좀 돼서 아직도 남았네요ㅎㅎ"
"요르요르","지성","여름쿨톤","민감성","블랙헤드","5점만점에 5점","2024.10.31","복합성에 좋아요","진정에 좋아요","자극없이 순해요","여드름 피부라 압출 후에 흔적 남는게 고민이었는데 이 제품은 압출 후에도 사용할 수 있고 흔적에도 사용 가능해서 좋아요!! 약간 패일듯한 상처부위에 도톰하게 얹으면 흉터 안남고 잘 아물어요!! 그치만 꼭 꾸준히 바르는게 중요한 것 같아요. 초반에는 없어지나? 싶지만 매일 바르면 확실히 색소침착이 옅어집니다!! 비타민c같은 제품은 매일 바르기엔 부담스러워서 자주 손이 안 가는데 이 제품은 스팟에만 바르니까 매일 바르는데 부담 없어요!"
"말티츄","지성","여름쿨톤","모공","잡티","5점만점에 5점","2024.10.26","지성에 좋아요","진정에 좋아요","자극없이 순해요","찐찐템😍이거 진짜 좋아..ㅋㅋ진짜 예전부터 썼던찐 of 찐템인데..한동안 안쓰다가 다시 찾았는데잘맞아서 또 엄청 쓰는중..무난하게 쓰기 좋은 템이지만내가 특히 추천하는건 트러블ing인 지성피부!내가 비슷한 카테고리의 다른 제품도 사용해봤는데 낫츠제품이 가장 가볍게 발리면서 효과가 좋아서지성피부한테는 가장 만족스럽게 느껴지더라구ㅋㅋ흔적관리에도 좋고..자극적이지않아서 너무 만족스러웠는데..유일한 단점이 가격ㅠ기획으로 구매해도 할인하면 개당 17,000원이고단품으로는 할인해서 18,000원ㅠ진짜 가격적인 메리트만 좀 괜찮아지면더 쟁여둘 의향있을 정도로제품력 자체는 완전 좋아ㅇㅇ바이럴이 좀 심했긴한데.. 이제는 좀 괜찮은 것 같으니까 더 이상 언급안하려고해도..리뷰에 좋은말만 쓰면 뒷광고같아보일까봐 매번 덧붙이고있어..ㅋㅋ👍도움이 돼요👍 눌러주면 다음에도 솔직한 리뷰로 돌아올께~~ 오늘도 내 리뷰 읽어줘서 고마워!!"
"신은혜","복합성","봄웜톤","모공","민감성","5점만점에 5점","2024.10.23","복합성에 좋아요","진정에 좋아요","자극없이 순해요","🫧피부타입: 수부지/민감피부/봄브라이트/겨울비비드🫧재구매후기이 제품 처음에는 반신반의하는 생각으로 구매해봤는데 너무 괜찮아서 재구매 했어요일단 이게 흔적 연고라고 해서 트러블 흔적에만 효과가 있을 줄 알았는데 금방 올라온 트러블에도 효과가 직방이여서 놀랐어요 저는 트러블, 모낭염 등에 다 사용했는데 다 효과 있었습니다그렇다고해서 흔적에 효과가 없는것도 아니에요 흔적에도 효과가 좋습니다 그냥 이 제품 하나 사 놓으면 트러블은 걱정이 없는거 같아요 다른 연고 하나도 필요없습니다제형은 완전 연고 제형인데 바르고 나면 끈적이지 않게 산뜻하게 마무리되고 그렇다고해서 건조한건 아니라 피부타입 가리지 않는거 같아요저는 이번에 산 것도 다 사용하면 또 재구매할 의사가 있습니다"
